### ISSUE TITLE
Repeated Console Entries

### ISSUE THREAD

**Issue by eohlde** [grafana/grafana#19977]
**What happened**:
**Grafana repeatedly shows Request Completed to a remote ip address**:

**What you expected to happen**:
**Grafana does not repeatedly reach out to a group of remote IP addresses**:

**How to reproduce it (as minimally and precisely as possible)**:
**Use docker-compose and attached docker-compose.yaml file. The VM that docker runs on should have no access to the open internet.**:
[docker-compose.yaml.txt](https://github.com/grafana/grafana/files/3763134/docker-compose.yaml.txt)

**Anything else we need to know?**:
**This is running in a cloud VPC, with a modified public folder (**containing custom css**)**:

**Environment**:
- Grafana version: 6.4 (grafana/grafana:latest as of 10/23/2019)
- Data source type & version:
- OS Grafana is installed on: Ubuntu 16.04, via docker
- User OS & Browser:
- Grafana plugins: only standard plugins
- Others:

This is what I see in the log of grafana (/var/log/grafana/grafana.log)

> lvl=info msg="Request Completed" logger=context userId=0 orgId=0 uname= method=HEAD path=/ status=302 remote_addr=100.117.104.96 time_ms=0 size=0 referer=
>lvl=info msg="Request Completed" logger=context userId=0 orgId=0 uname= method=HEAD path=/ status=302 remote_addr=100.117.104.20 time_ms=0 size=0 referer=
>lvl=info msg="Request Completed" logger=context userId=0 orgId=0 uname= method=HEAD path=/ status=302 remote_addr=100.117.104.66 time_ms=0 size=0 referer=
>lvl=info msg="Request Completed" logger=context userId=0 orgId=0 uname= method=HEAD path=/ status=302 remote_addr=100.117.205.34 time_ms=0 size=0 referer=
>lvl=info msg="Request Completed" logger=context userId=0 orgId=0 uname= method=HEAD path=/ status=302 remote_addr=100.117.104.83 time_ms=0 size=0 referer=
>lvl=info msg="Request Completed" logger=context userId=0 orgId=0 uname= method=HEAD path=/ status=302 remote_addr=100.117.205.27 time_ms=0 size=0 referer=
>lvl=info msg="Request Completed" logger=context userId=0 orgId=0 uname= method=HEAD path=/ status=302 remote_addr=100.117.205.11 time_ms=0 size=0 referer=
>lvl=info msg="Request Completed" logger=context userId=0 orgId=0 uname= method=HEAD path=/ status=302 remote_addr=100.117.104.46 time_ms=0 size=0 referer=

**Comment by eohlde** [comment]
If I do a tcpdump I get:
IPREDACTED.3000 > 100.117.104.82.31917: Flags [S.], seq 1032802069, ack 3439875653, win 28960, options [mss 1460,sackOK,TS val 1326269 ecr 4158647186,nop,wscale 7], length 0
IP IPREDACTED.3000 > 100.117.104.82.31917: Flags [.], ack 20, win 227, options [nop,nop,TS val 1326269 ecr 4158647187], length 0
IP IPREDACTED.3000 > 100.117.104.82.31917: Flags [P.], seq 1:246, ack 20, win 227, options [nop,nop,TS val 1326269 ecr 4158647187], length 245
IP IPREDACTED.3000 > 100.117.104.82.31917: Flags [F.], seq 246, ack 20, win 227, options [nop,nop,TS val 1326269 ecr 4158647187], length 0

**Comment by torkelo** [comment]
Those are incoming requests (to Grafnaa) that you see being logged / , so something is requesting the root page. 

since it's a HEAD call it could be a router / load balancer, or kubernetes (container) keep alive prove

**Comment by eohlde** [comment]
@torkelo, The IPredacted is the IP address of grafana, the 100.117 is an external IP address. 
Doesn't the tcpdump output show that grafana is reaching out?

**Comment by torkelo** [comment]
The log entries in 
/var/log/grafana/grafana.log 

Was for incoming network requests to Grafana.
