### ISSUE TITLE
[Bug] Data-source proxy-request always takes at least 10 seconds

### ISSUE THREAD

**Issue by jaylinski** [grafana/grafana#6718]
### Information

- What Grafana version are you using?
 Grafana v4.0.0-beta2 (commit: c643466) 
- What datasource are you using?
InfluxDB 1.1.0
- What OS are you running grafana on?
:whale: Official Grafana Docker image on Boot2Docker version 1.12.3, build HEAD : 7fc7575 
- What did you do?
Query data from (a non-https) InfluxDB source (`http://influxdb:8086`) via proxy.
- What was the expected result?
Query returns in less than a second.
- What happened instead?
Query always takes at least 10 seconds. :clock10: This happens on every proxied request.

### Request
The request from the debug log:
```
t=2016-11-27T01:12:50+0000 lvl=info msg="Request Completed" logger=context userId=1 orgId=1 uname=admin method=GET path=/query status=200 remote_addr=10.0.0.18 time_ms=10.008µs size=114
```
The xhr request the browser is sending:
```
http://grafana/api/datasources/proxy/1/query?db=fluentd&q=SHOW%20MEASUREMENTS%20LIMIT%201&epoch=ms
```
This request is proxied through a nginx with `proxy_pass`.

### Additional info

Normal (non-proxy) requests are fast:
```
t=2016-11-27T01:12:40+0000 lvl=info msg="Request Completed" logger=context userId=1 orgId=1 uname=admin method=GET path=/api/frontend/settings status=200 remote_addr=10.0.0.18 time_ms=2ns size=5219
```

* I'm using a non-https data-source!
* I'm using Docker version 1.12.3, build 6b644ec in swarm mode.
* The Influx-Database is on a different machine. 
* A direct curl request from within the Grafana-Docker-Image to the InfluxDB data-source is fast and takes only a few milliseconds.
* I think I'm running into a `TLSHandshakeTimeout`, because this is set to 10 seconds. And I think it has to do with the docker-service communication between swarm nodes (which happens over TLS)

**Comment by torkelo** [comment]
no idea what could be causing this.

**Comment by jaylinski** [comment]
I'll try to debug it so I can give you more information.

**Comment by jaylinski** [comment]
@torkelo It looks like IPv6 is the problem.

### Docker daemon logs

This is what the docker-daemon reports when clicking on "Save & Test" in the data source section:

```
time="2016-11-28T19:54:00.882069402Z" level=debug msg="Name To resolve: influxdb.home." 
time="2016-11-28T19:54:00.882197942Z" level=debug msg="Query influxdb.home.[28] from 172.18.0.6:47508, forwarding to udp:10.0.2.3" 
time="2016-11-28T19:54:00.882641873Z" level=debug msg="Name To resolve: influxdb.home." 
time="2016-11-28T19:54:00.882728945Z" level=debug msg="Query influxdb.home.[1] from 172.18.0.6:40758, forwarding to udp:10.0.2.3" 
time="2016-11-28T19:54:04.882482686Z" level=debug msg="Read from DNS server failed, read udp 172.18.0.6:47508->10.0.2.3:53: i/o timeout" 
time="2016-11-28T19:54:04.882919303Z" level=debug msg="Read from DNS server failed, read udp 172.18.0.6:40758->10.0.2.3:53: i/o timeout" 
time="2016-11-28T19:54:05.882424007Z" level=debug msg="Name To resolve: influxdb.home." 
time="2016-11-28T19:54:05.882592948Z" level=debug msg="Query influxdb.home.[28] from 172.18.0.6:41973, forwarding to udp:10.0.2.3" 
time="2016-11-28T19:54:05.883257600Z" level=debug msg="Name To resolve: influxdb.home." 
time="2016-11-28T19:54:05.885524217Z" level=debug msg="Query influxdb.home.[1] from 172.18.0.6:48810, forwarding to udp:10.0.2.3" 
time="2016-11-28T19:54:09.882822085Z" level=debug msg="Read from DNS server failed, read udp 172.18.0.6:41973->10.0.2.3:53: i/o timeout" 
time="2016-11-28T19:54:09.885721469Z" level=debug msg="Read from DNS server failed, read udp 172.18.0.6:48810->10.0.2.3:53: i/o timeout" 
time="2016-11-28T19:54:10.883632595Z" level=debug msg="Name To resolve: influxdb." 
time="2016-11-28T19:54:10.883704484Z" level=debug msg="Lookup name influxdb. present without IPv6 address" 
time="2016-11-28T19:54:10.884082158Z" level=debug msg="Name To resolve: influxdb." 
time="2016-11-28T19:54:10.886398399Z" level=debug msg="Lookup for influxdb.: IP [10.0.0.4]" 
```

These logs are written if I execute `curl http://influxdb:8086/query? --ipv6` from within the Grafana container:
```
time="2016-11-28T21:04:54.577914718Z" level=debug msg="Name To resolve: influxdb." 
time="2016-11-28T21:04:54.577978933Z" level=debug msg="Lookup name influxdb. present without IPv6 address" 
time="2016-11-28T21:04:54.578176660Z" level=debug msg="Name To resolve: influxdb.home." 
time="2016-11-28T21:04:54.578296408Z" level=debug msg="Query influxdb.home.[28] from 172.18.0.6:54391, forwarding to udp:10.0.2.3" 
time="2016-11-28T21:04:56.309799980Z" level=debug msg="2016/11/28 21:04:56 [DEBUG] memberlist: TCP connection from=192.168.99.100:36356\n" 
time="2016-11-28T21:04:58.578517385Z" level=debug msg="Read from DNS server failed, read udp 172.18.0.6:54391->10.0.2.3:53: i/o timeout" 
time="2016-11-28T21:04:59.583766347Z" level=debug msg="Name To resolve: influxdb.home." 
time="2016-11-28T21:04:59.583928605Z" level=debug msg="Query influxdb.home.[28] from 172.18.0.6:34518, forwarding to udp:10.0.2.3" 
time="2016-11-28T21:05:03.584083237Z" level=debug msg="Read from DNS server failed, read udp 172.18.0.6:34518->10.0.2.3:53: i/o timeout" 
```

When executing `curl http://influxdb:8086/query? --ipv4` , the following logs are written and the domain resolves immediately:
```
time="2016-11-28T21:00:22.722884952Z" level=debug msg="Name To resolve: influxdb." 
time="2016-11-28T21:00:22.722947107Z" level=debug msg="Lookup name influxdb. present without IPv6 address" 
time="2016-11-28T21:00:22.723045340Z" level=debug msg="Name To resolve: influxdb." 
time="2016-11-28T21:00:22.723087419Z" level=debug msg="Lookup for influxdb.: IP [10.0.0.4]" 
```

Seems like Docker is trying to resolve the name with a IPv6 address.
But I don't know if that's the fault of the grafana dataproxy...

**Comment by lepiaf** [comment]
hi,

I have the same issue after migrating from v3 to v4

## Information
* What Grafana version are you using?
    Grafana v4.0.0 (commit: v4.0.0)
* What datasource are you using?
  InfluxDB v0.12.1
*    What OS are you running grafana on?
   Ubuntu 16.04 
*  What did you do?
    Query data from (a non-https) InfluxDB source (http://influxdb:8086) via proxy.
 *  What was the expected result?
    Query returns in less than a second.
 *   What happened instead?
    Query always takes at least 10 seconds. 🕙 This happens on every proxied request.

I try datasource as direct, and it is faster than proxy.

**Comment by jaylinski** [comment]
I'll check if the issue still exists with Docker 1.13 (will be released in december).

**Comment by jaylinski** [comment]
Still happening with latestet Grafana 4.0.1.

**Comment by lepiaf** [comment]
Yesterday, I've update Grafana to v4.0.1 and influxdb to 1.1.0.

I've also try to change url of datasource by using ip instead of host name.

If I change this
```
Url: http://localhost:8086
```
to this
```
Url: http://127.0.0.1:8086
```

It is really faster. 

Can you try this @jaylinski ?

**Comment by jaylinski** [comment]
@lepiaf Nope, can't try it, because my InfluxDB is on a different host/machine. The swarm-communication is done by a docker overlay-network.

Docker swarm mode is still in its early stages, so it's possible that the issue is caused by Docker.
That's why I want to test if the issue still exists with Docker 1.13 (which will be released this month).

**Comment by torkelo** [comment]
Closing this as it seems like a docker/networking/dns issue

**Comment by jaylinski** [comment]
The issue still exists with Docker 1.13. :disappointed:

**Comment by jaylinski** [comment]
@torkelo One of the Docker members pointet out to me that the request sent by Grafana is trying to  resolve the domain `influxdb.home.` instead of only `influxdb.`. (As can be seen in the logs above.)

Do you have any idea why this is happening? Could this be a dataproxy issue?

![grafana](https://cloud.githubusercontent.com/assets/1668766/22226476/eba5b0d2-e1c6-11e6-965d-c09f6d685f54.png)

**Comment by torkelo** [comment]
No, might be a DNS issue then, depending on what docker network stack your using.  Grafana does not add the home top level domain, that is probably done the network layer

**Comment by jaylinski** [comment]
@torkelo yeah, seems like a DNS issue.

The weird thing is: with `curl` I can reach InfluxDB from within the container without problems:
```
$ curl "http://influxdb:8086/query?q=SHOW+DATABASES&db=cadvisor" -v
* Hostname was NOT found in DNS cache
*   Trying 192.168.10.6...
* Connected to influxdb (192.168.10.6) port 8086 (#0)
> GET /query?q=SHOW+DATABASES&db=cadvisor HTTP/1.1
> User-Agent: curl/7.38.0
> Host: influxdb:8086
> Accept: */*
> 
< HTTP/1.1 200 OK
< Connection: close
< Content-Type: application/json
< Request-Id: 8c7f5d81-e4e2-11e6-8770-000000000000
< X-Influxdb-Version: 1.2.0
< Date: Fri, 27 Jan 2017 22:47:15 GMT
< Transfer-Encoding: chunked
< 
{"results":[{"statement_id":0,"series":[{"name":"databases","columns":["name"],"values":[["_internal"],["cadvisor"]]}]}]}
* Closing connection 0
```

But as soon as the Grafana dataproxy is involved, I experience DNS issues (10s delay).

The `home` suffix probably originates from `resolv.conf` inside the container.
```
$ cat /etc/resolv.conf 
search home
nameserver 127.0.0.11
options ndots:0
```

I searched the golang repository, but all issues regarding DNS seem to be resolved in the latest releases...

tcpdump:
```
23:04:33.058625 IP 10.255.0.5.60438 > 10.255.0.8.3000: Flags [P.], seq 124967832:124968676, ack 477068543, win 8554, options [nop,nop,TS val 3698828 ecr 1306560], length 844
23:04:33.058654 IP 10.255.0.8.3000 > 10.255.0.5.60438: Flags [.], ack 844, win 428, options [nop,nop,TS val 1306796 ecr 3698828], length 0
23:04:33.063515 IP 10.255.0.8.3000 > 10.255.0.5.60438: Flags [P.], seq 1:162, ack 844, win 428, options [nop,nop,TS val 1306796 ecr 3698828], length 161
23:04:33.064039 IP 10.255.0.5.60438 > 10.255.0.8.3000: Flags [.], ack 162, win 8554, options [nop,nop,TS val 3698830 ecr 1306796], length 0
23:04:33.083401 IP 10.255.0.5.60438 > 10.255.0.8.3000: Flags [P.], seq 844:1335, ack 162, win 8554, options [nop,nop,TS val 3698834 ecr 1306796], length 491
23:04:33.084461 IP 10.255.0.8.3000 > 10.255.0.5.60438: Flags [P.], seq 162:4258, ack 1335, win 441, options [nop,nop,TS val 1306798 ecr 3698834], length 4096
23:04:33.084924 IP 10.255.0.8.3000 > 10.255.0.5.60438: Flags [P.], seq 4258:6246, ack 1335, win 441, options [nop,nop,TS val 1306798 ecr 3698834], length 1988
23:04:33.085232 IP 10.255.0.5.60438 > 10.255.0.8.3000: Flags [.], ack 4258, win 8554, options [nop,nop,TS val 3698835 ecr 1306798], length 0
23:04:33.085250 IP 10.255.0.5.60438 > 10.255.0.8.3000: Flags [.], ack 6246, win 8554, options [nop,nop,TS val 3698835 ecr 1306798], length 0
23:04:33.128069 IP 10.255.0.5.60438 > 10.255.0.8.3000: Flags [P.], seq 1335:1877, ack 6246, win 8554, options [nop,nop,TS val 3698846 ecr 1306798], length 542
23:04:33.165675 IP 10.255.0.8.3000 > 10.255.0.5.60438: Flags [.], ack 1877, win 454, options [nop,nop,TS val 1306807 ecr 3698846], length 0
23:04:33.199808 IP 10.255.0.5.60434 > 10.255.0.8.3000: Flags [.], ack 2721177933, win 584, options [nop,nop,TS val 3698864 ecr 1305808], length 0
23:04:33.199829 IP 10.255.0.8.3000 > 10.255.0.5.60434: Flags [.], ack 1, win 244, options [nop,nop,TS val 1306810 ecr 3673825], length 0
23:04:33.199830 IP 10.255.0.5.60436 > 10.255.0.8.3000: Flags [.], ack 2183672728, win 2155, options [nop,nop,TS val 3698864 ecr 1305808], length 0
23:04:33.199834 IP 10.255.0.8.3000 > 10.255.0.5.60436: Flags [.], ack 1, win 254, options [nop,nop,TS val 1306810 ecr 3673825], length 0
23:04:43.136779 IP 10.255.0.8.3000 > 10.255.0.5.60438: Flags [P.], seq 6246:6549, ack 1877, win 454, options [nop,nop,TS val 1307804 ecr 3698846], length 303
23:04:43.176011 IP 10.255.0.5.60438 > 10.255.0.8.3000: Flags [.], ack 6549, win 8554, options [nop,nop,TS val 3701358 ecr 1307804], length 0
23:04:43.216022 IP 10.255.0.5.60434 > 10.255.0.8.3000: Flags [.], ack 1, win 584, options [nop,nop,TS val 3701368 ecr 1306810], length 0
23:04:43.216048 IP 10.255.0.8.3000 > 10.255.0.5.60434: Flags [.], ack 1, win 244, options [nop,nop,TS val 1307812 ecr 3673825], length 0
23:04:43.216050 IP 10.255.0.5.60436 > 10.255.0.8.3000: Flags [.], ack 1, win 2155, options [nop,nop,TS val 3701368 ecr 1306810], length 0
```

I'll try to find out what's going on there exactly.
